{
  "_ns": {
    "Oscar": [
      "https://github.com/oscar-system/Oscar.jl",
      "1.0.5"
    ]
  },
  "_type": {
    "name": "MPolyRingElem",
    "params": "f0885e3e-71ff-4813-88fd-7ee05eeb3657"
  },
  "data": [
    [
      [
        "3",
        "4"
      ],
      [
        [
          "0",
          "2"
        ]
      ]
    ],
    [
      [
        "1",
        "0"
      ],
      [
        [
          "1",
          "5"
        ]
      ]
    ],
    [
      [
        "0",
        "2"
      ],
      [
        [
          "0",
          "3"
        ],
        [
          "1",
          "1"
        ]
      ]
    ],
    [
      [
        "0",
        "0"
      ],
      [
        [
          "0",
          "1"
        ]
      ]
    ]
  ],
  "_refs": {
    "f0885e3e-71ff-4813-88fd-7ee05eeb3657": {
      "_type": "MPolyRing",
      "data": {
        "base_ring": "e06a6ac9-954b-4fb7-89c6-f2a25489440e",
        "symbols": [
          "y",
          "z"
        ]
      }
    },
    "e06a6ac9-954b-4fb7-89c6-f2a25489440e": {
      "_type": "FqField",
      "data": {
        "_type": {
          "name": "PolyRingElem",
          "params": "3a66dcbd-bd73-4bb7-8b99-42d9f5177893"
        },
        "data": [
          [
            "0",
            "1"
          ],
          [
            "2",
            "1"
          ]
        ]
      }
    },
    "3a66dcbd-bd73-4bb7-8b99-42d9f5177893": {
      "_type": "PolyRing",
      "data": {
        "base_ring": "221dfa92-69df-4b5a-8f30-166aafddfaa9",
        "symbols": [
          "x"
        ]
      }
    },
    "221dfa92-69df-4b5a-8f30-166aafddfaa9": {
      "_type": "FqField",
      "data": "7"
    }
  }
}
